{
  "contract": {
    "name": "hausman-hasc-climate-draft-save",
    "version": 1
  },
  "saved_at": 1784280000000,
  "snapshot_revision": 8115739542118920,
  "draft_revision": 2766488448644126,
  "status": "saved",
  "commands_sent": false,
  "restart_required": false,
  "contour": {
    "id": "climate",
    "name": "Климат дома",
    "mode": "automatic"
  },
  "summary": {
    "room_count": 2,
    "device_count": 2
  }
}
